case_id,customer_id,created_at,issue_type,priority,case_note,case_status
CASE000261,CUST000139,2026-01-24 17:34:34,payment delay,low,Omnis veritatis eveniet quasi quasi vero necessitatibus distinctio aliquid officia eum.,in_progress
CASE000262,CUST000881,2026-05-25 17:34:34,payment delay,low,Quia molestias nobis at ducimus dolores quo id accusantium dignissimos harum illo.,resolved
CASE000263,CUST000532,2026-04-03 17:34:34,address change,medium,Blanditiis laudantium inventore rem est placeat consectetur pariatur rerum maiores laudantium suscipit labore natus.,closed
CASE000264,CUST000323,2025-12-04 17:34:34,fraud concern,high,At in fuga delectus occaecati at maiores voluptate perspiciatis officia quae ut minima officia assumenda iusto aspernatur reiciendis error voluptates.,closed
CASE000265,CUST000860,2026-05-20 17:34:34,fraud concern,low,Sapiente minima eos aliquid asperiores aliquid autem incidunt atque optio necessitatibus ducimus ducimus aspernatur magnam beatae optio.,closed
CASE000266,CUST000967,2025-12-29 17:34:34,credit limit question,medium,Ratione sapiente aliquid impedit provident et quam quidem ipsum repellat exercitationem ullam repellat distinctio.,in_progress
CASE000267,CUST000441,2026-04-10 17:34:34,fraud concern,low,Quia nobis sit autem modi ab blanditiis cupiditate labore porro sit vitae.,open
CASE000268,CUST000125,2026-05-07 17:34:34,address change,high,Quas esse repellat nulla porro vitae perferendis rem assumenda consequatur deleniti repellendus possimus deleniti ad laboriosam corporis doloribus sapiente similique molestiae assumenda quo corporis.,closed
CASE000269,CUST000724,2025-12-22 17:34:34,credit limit question,medium,Accusantium cumque corrupti praesentium vitae iusto similique nesciunt dicta necessitatibus rerum amet ab occaecati quae voluptatem sed qui nisi mollitia.,open
CASE000270,CUST000787,2026-05-12 17:34:34,address change,low,Alias id maiores quam vel temporibus sint doloremque aperiam accusantium nemo mollitia eaque officia suscipit blanditiis numquam.,resolved
CASE000271,CUST000213,2026-04-08 17:34:34,login problem,low,Ipsum ipsa cum quas iusto ipsa magni nesciunt placeat ullam sequi quaerat iusto sunt quam hic impedit velit.,open
CASE000272,CUST000520,2026-03-12 17:34:34,account closure request,medium,Recusandae reiciendis sapiente numquam eligendi quibusdam pariatur consectetur dicta non aut impedit voluptatibus esse distinctio aliquid accusantium sunt explicabo.,resolved
CASE000273,CUST000999,2026-01-09 17:34:34,payment delay,low,Cupiditate similique magnam rem excepturi beatae dolorem natus laborum voluptatibus quos quo quo nam.,closed
CASE000274,CUST000098,2025-12-24 17:34:34,card dispute,low,Sequi soluta nobis aut amet veniam reiciendis vitae quidem voluptate quos non similique aut.,open
CASE000275,CUST000575,2025-12-10 17:34:34,address change,medium,Aliquam autem occaecati sit tenetur culpa eos ipsam magni quasi aut officia ex consequuntur sed ipsa impedit quisquam doloribus repellat exercitationem magnam assumenda.,resolved
CASE000276,CUST000715,2026-02-10 17:34:34,fraud concern,low,Quaerat impedit occaecati doloribus quidem minus ratione consequuntur inventore ullam tempore veritatis maiores placeat velit ipsam quo quaerat maxime.,closed
CASE000277,CUST000287,2026-05-26 17:34:34,login problem,low,Assumenda et voluptatem cum aperiam quis optio odit temporibus animi occaecati quae.,resolved
CASE000278,CUST000363,2026-04-20 17:34:34,payment delay,medium,Voluptate in suscipit praesentium sit quam et exercitationem repudiandae tempore nostrum corporis illo officia suscipit numquam nulla ipsam exercitationem repellat officiis quod.,open
CASE000279,CUST000122,2026-04-06 17:34:34,address change,low,Assumenda modi harum quaerat sunt maxime molestiae distinctio maiores est exercitationem odio ad tempora molestiae ea rerum.,resolved
CASE000280,CUST000809,2026-03-14 17:34:34,address change,medium,Quas voluptates beatae animi fuga occaecati explicabo aliquid officiis commodi error qui iste voluptatem rem voluptates natus.,closed
CASE000281,CUST000032,2026-01-11 17:34:34,login problem,medium,Pariatur sapiente doloremque error pariatur repellendus nemo consequuntur fugiat qui autem maiores deserunt quod iste corporis incidunt illum at incidunt consectetur dolor aspernatur perspiciatis illo.,closed
CASE000282,CUST000910,2025-12-13 17:34:34,card dispute,high,Maxime hic ea libero incidunt ipsam ut laudantium voluptate reprehenderit corporis consectetur quae consectetur provident sint blanditiis distinctio labore quia velit fuga veritatis.,resolved
CASE000283,CUST000929,2026-02-21 17:34:34,credit limit question,medium,Sequi beatae fuga enim minima blanditiis esse fugiat eos adipisci corporis quos in vel esse eligendi delectus qui a molestias architecto aliquid laboriosam est.,in_progress
CASE000284,CUST000148,2026-04-05 17:34:34,card dispute,low,Tempore quos labore quam non quis magnam itaque ipsum ipsum sint eveniet reiciendis optio illum doloremque hic molestiae vero suscipit quasi.,open
CASE000285,CUST000099,2026-03-11 17:34:34,card dispute,medium,Sint provident nemo recusandae provident natus commodi nam deserunt nulla nemo amet.,closed
CASE000286,CUST000086,2026-05-15 17:34:34,credit limit question,medium,Maxime quibusdam magnam accusantium omnis minus vitae eius dignissimos rerum saepe neque assumenda modi eum nihil laudantium ut excepturi debitis ad minus fugit.,open
CASE000287,CUST000311,2026-05-18 17:34:34,login problem,low,Beatae aut cumque corporis ducimus at esse illum cumque nostrum eveniet ad.,resolved
CASE000288,CUST000786,2026-03-08 17:34:34,payment delay,low,Error atque consequuntur tempora ducimus velit tempore amet dolores nisi dolores magni.,in_progress
CASE000289,CUST000417,2026-02-23 17:34:34,address change,low,Harum beatae aperiam iure illum laborum illum doloremque suscipit eaque vitae perferendis doloribus mollitia quos esse illum assumenda odio dignissimos voluptas fuga.,resolved
CASE000290,CUST000136,2026-05-20 17:34:34,account closure request,low,Quos modi incidunt tenetur iste a iure repudiandae enim voluptas a ut laboriosam nisi.,in_progress
CASE000291,CUST000807,2026-04-14 17:34:34,address change,high,Voluptatum sapiente distinctio sapiente eligendi cum modi architecto at praesentium rerum quam voluptatum soluta distinctio magnam reiciendis sunt veniam.,in_progress
CASE000292,CUST000336,2025-12-18 17:34:34,credit limit question,medium,Voluptatem provident earum optio eum distinctio vero eveniet totam consequatur ullam non a ab cupiditate nam.,resolved
CASE000293,CUST000636,2026-03-04 17:34:34,account closure request,low,Quis modi ratione officiis aspernatur adipisci rerum perferendis perferendis explicabo repellat repudiandae facere debitis quisquam possimus ab iure vel ipsam dolore.,resolved
CASE000294,CUST000462,2026-02-11 17:34:34,payment delay,medium,Quis perspiciatis quae deleniti repellendus numquam repellat dolore voluptatem voluptas alias.,open
CASE000295,CUST000774,2025-12-28 17:34:34,login problem,low,Temporibus provident distinctio deserunt reprehenderit id sit necessitatibus laudantium mollitia optio natus placeat natus aperiam consectetur aperiam ea necessitatibus dolorem minima quos.,resolved
CASE000296,CUST000557,2026-02-12 17:34:34,login problem,low,Sed ad voluptas perspiciatis nostrum perspiciatis sunt a incidunt perferendis officiis sequi eum sapiente illum.,closed
CASE000297,CUST000229,2026-05-08 17:34:34,payment delay,low,Perspiciatis iure facere quis sunt dolore eius in ipsum a deserunt aspernatur nemo.,closed
CASE000298,CUST000006,2026-03-18 17:34:34,card dispute,medium,Voluptatibus dolorem porro vero totam deserunt eveniet aperiam numquam adipisci inventore.,closed
CASE000299,CUST000115,2026-01-08 17:34:34,card dispute,low,Nihil numquam ex dolorum autem dolores exercitationem amet ex recusandae velit.,in_progress
CASE000300,CUST000766,2026-02-09 17:34:34,card dispute,medium,Nulla quisquam numquam neque assumenda aperiam alias et sed aperiam consectetur ullam ipsam error numquam aperiam perspiciatis nam eos fugit atque quibusdam doloremque nobis.,open
