case_id,customer_id,created_at,issue_type,priority,case_note,case_status
CASE000129,CUST000541,2026-03-13 17:34:34,fraud concern,low,Quibusdam soluta ipsa odit modi tenetur laboriosam dolorem at est impedit culpa ab minima quis consequatur enim modi porro laudantium quidem error quisquam reiciendis nisi.,closed
CASE000130,CUST000101,2026-03-12 17:34:34,account closure request,high,Molestias deleniti sunt ipsa dolorum quaerat officia repudiandae dolore aspernatur.,in_progress
CASE000131,CUST000301,2026-01-24 17:34:34,login problem,medium,Dolores quisquam tenetur rem placeat eligendi quia repellat impedit sequi delectus enim odio nulla earum numquam deleniti accusantium amet modi delectus aut eaque quaerat quas.,closed
CASE000132,CUST000355,2026-02-07 17:34:34,fraud concern,low,At accusamus dolor in ratione libero fuga possimus adipisci aspernatur quibusdam corporis eaque hic molestiae delectus.,in_progress
CASE000133,CUST000202,2025-12-07 17:34:34,account closure request,high,Repellendus repudiandae commodi quisquam dolorum quo ipsam qui alias itaque quo maxime voluptatem labore placeat est.,resolved
CASE000134,CUST000880,2026-05-02 17:34:34,credit limit question,low,Culpa quas quia mollitia commodi laboriosam error facere amet pariatur voluptate doloremque ipsa accusamus recusandae nesciunt id doloribus.,closed
CASE000135,CUST000999,2026-02-23 17:34:34,fraud concern,low,Neque porro porro culpa quo dolorum libero placeat excepturi voluptas quis.,closed
CASE000136,CUST000975,2026-04-21 17:34:34,fraud concern,medium,Animi officia praesentium recusandae commodi doloremque voluptatem ratione quidem rem ipsa deserunt.,resolved
CASE000137,CUST000358,2026-02-15 17:34:34,card dispute,medium,Facere consequatur tempore laborum ipsa eos possimus deleniti delectus expedita quasi eius rerum totam mollitia architecto culpa eos ea.,in_progress
CASE000138,CUST000343,2025-12-03 17:34:34,fraud concern,low,Iste quod magni quasi sunt nulla facilis nulla eum aperiam voluptas reprehenderit deleniti placeat quisquam culpa eligendi illum eum.,closed
CASE000139,CUST000615,2026-02-13 17:34:34,fraud concern,medium,Minima architecto saepe consectetur sit dicta laborum atque necessitatibus saepe omnis minima.,closed
CASE000140,CUST000967,2026-01-04 17:34:34,payment delay,high,Ducimus facilis non architecto ut dignissimos laudantium suscipit aspernatur reiciendis aperiam nam vel impedit fuga provident reprehenderit eaque aliquam architecto esse velit vero atque.,open
CASE000141,CUST000524,2026-02-05 17:34:34,address change,medium,Minus deleniti minima dolorum numquam debitis quibusdam impedit autem odit facere itaque pariatur sunt cumque debitis.,closed
CASE000142,CUST000214,2026-01-30 17:34:34,card dispute,low,Magnam omnis modi nobis ut temporibus mollitia voluptatum sapiente impedit odio repudiandae eum dolores molestias fugiat mollitia quia facere.,open
CASE000143,CUST000725,2026-05-21 17:34:34,fraud concern,low,Ipsum id quas voluptatem nisi maxime voluptatibus error error dolore sequi accusantium reprehenderit porro eius mollitia nam unde culpa alias explicabo.,open
CASE000144,CUST000227,2025-12-24 17:34:34,address change,low,Eaque suscipit dolorum ducimus error necessitatibus necessitatibus dolor aspernatur eveniet laboriosam laborum tempore.,open
CASE000145,CUST000418,2026-03-17 17:34:34,card dispute,low,Reprehenderit atque odit alias repellat fugit quod ullam ex sunt ipsa ut blanditiis quo quibusdam sed ut odio odio amet minima eum natus.,open
CASE000146,CUST000077,2026-02-06 17:34:34,account closure request,low,Magnam dolore amet quasi hic ipsum nisi magnam dolore enim hic consequatur assumenda nemo aliquid id assumenda magnam.,resolved
CASE000147,CUST000362,2026-05-27 17:34:34,login problem,high,Quis laboriosam dicta hic necessitatibus natus voluptatum minima doloribus eaque inventore placeat nemo.,open
CASE000148,CUST000337,2026-03-30 17:34:34,card dispute,low,Perferendis incidunt expedita eum nisi ad esse voluptates nulla voluptatibus ipsam corporis aliquid.,in_progress
CASE000149,CUST000267,2026-04-16 17:34:34,payment delay,low,Dicta fugiat quidem sequi beatae amet veniam unde sit reprehenderit accusamus possimus beatae ipsum ad distinctio.,resolved
CASE000150,CUST000116,2026-02-26 17:34:34,card dispute,low,Distinctio molestias quibusdam molestias numquam voluptatibus possimus pariatur fugiat temporibus minima ducimus animi dicta possimus earum iure veniam architecto optio optio totam facere.,closed
CASE000151,CUST000957,2025-12-10 17:34:34,fraud concern,medium,Accusantium sint officiis doloremque fugit voluptate aut et sint minus delectus magnam itaque.,resolved
CASE000152,CUST000666,2026-05-12 17:34:34,credit limit question,medium,Aliquam ullam esse laudantium quia accusantium placeat explicabo esse voluptatum voluptatem.,in_progress
CASE000153,CUST000599,2026-05-20 17:34:34,card dispute,low,Repellat numquam soluta tempora repellendus adipisci mollitia eius corrupti tempore omnis assumenda fugit vero nostrum numquam dolorem.,in_progress
CASE000154,CUST000703,2026-03-15 17:34:34,credit limit question,low,Nemo incidunt est non ipsum consectetur officiis neque placeat dicta consequuntur porro tempore tenetur inventore tenetur.,resolved
CASE000155,CUST000338,2026-03-01 17:34:34,login problem,low,Omnis natus culpa architecto minus quaerat delectus saepe corporis adipisci eum voluptate vero esse.,in_progress
CASE000156,CUST000696,2026-05-27 17:34:34,payment delay,high,Corrupti deleniti consectetur ad voluptates nulla non nostrum nisi doloremque ad aspernatur quod consequatur sapiente iusto officiis.,open
CASE000157,CUST000423,2026-02-02 17:34:34,account closure request,medium,Sequi laudantium consequuntur deserunt adipisci quisquam accusamus earum impedit quia voluptates quidem architecto unde.,closed
CASE000158,CUST000468,2026-04-28 17:34:34,card dispute,medium,Sint laudantium eveniet itaque doloribus illo aliquam quasi fugit est nostrum quia nisi minima soluta ratione maxime iste repudiandae aliquam.,open
CASE000159,CUST000659,2026-05-26 17:34:34,credit limit question,low,Maxime id quasi nam maiores occaecati aliquid enim id esse repudiandae itaque in nostrum amet maxime.,resolved
CASE000160,CUST000641,2026-03-12 17:34:34,credit limit question,medium,Iure officia at magnam debitis nesciunt tempora molestias hic eum ad iste tempore tempore.,open
CASE000161,CUST000023,2026-02-21 17:34:34,card dispute,low,At eum officiis quae cum quasi at provident odio assumenda provident quas voluptate nostrum cum mollitia aliquam cupiditate excepturi sit sint.,in_progress
CASE000162,CUST000215,2026-01-18 17:34:34,login problem,medium,Sit debitis quae in est quisquam ipsum occaecati blanditiis consectetur dicta numquam ducimus itaque.,open
CASE000163,CUST000518,2026-05-13 17:34:34,address change,medium,Molestiae ab sunt dolores nihil labore illum aspernatur nobis doloribus molestias nulla nam repudiandae aliquid corporis officiis alias sequi pariatur saepe error.,in_progress
CASE000164,CUST000775,2026-04-16 17:34:34,payment delay,low,Aliquid impedit debitis perferendis nostrum porro nisi ratione debitis iste neque ut.,open
CASE000165,CUST000656,2026-03-18 17:34:34,card dispute,low,Quisquam eum tempore reprehenderit quis sapiente aperiam iusto commodi similique eveniet impedit.,resolved
CASE000166,CUST000181,2026-02-13 17:34:34,account closure request,low,Possimus nostrum autem quas occaecati voluptates laborum porro ut voluptates enim non et minima voluptatum.,closed
CASE000167,CUST000795,2026-04-30 17:34:34,account closure request,low,Unde nostrum libero quas libero repellat sunt doloremque enim deserunt blanditiis iure reiciendis qui dignissimos nostrum impedit aliquid.,resolved
CASE000168,CUST000892,2026-02-21 17:34:34,login problem,low,Nam odit accusamus dicta eligendi ratione est magni eum ab placeat exercitationem quam nulla adipisci cupiditate ex excepturi.,closed
CASE000169,CUST000233,2026-04-24 17:34:34,fraud concern,low,Totam reiciendis officia laboriosam occaecati tempora modi ex quos impedit quia rerum error quam et modi dignissimos placeat reiciendis suscipit explicabo.,closed
CASE000170,CUST000764,2026-04-28 17:34:34,payment delay,medium,Eligendi adipisci voluptates occaecati sapiente necessitatibus harum nisi sint quibusdam provident et adipisci impedit.,open
CASE000171,CUST000188,2026-04-09 17:34:34,address change,medium,Soluta fuga repudiandae esse minima cupiditate fugiat alias dicta at magni reiciendis temporibus culpa excepturi laboriosam soluta est eveniet quo atque voluptatem.,closed
CASE000172,CUST000404,2026-01-06 17:34:34,address change,medium,Perspiciatis consequatur quam itaque quae minima a ut porro nisi assumenda iure aliquid maxime omnis est neque est tempora eum deserunt eius.,closed
CASE000173,CUST000482,2026-05-12 17:34:34,fraud concern,low,Quo perferendis earum culpa beatae vero nam aut molestiae molestias earum velit rem nemo cupiditate est tempora molestiae.,closed
CASE000174,CUST000566,2025-12-15 17:34:34,payment delay,medium,Consectetur iusto perferendis autem amet incidunt debitis nisi nihil saepe praesentium.,closed
CASE000175,CUST000224,2026-03-01 17:34:34,card dispute,high,Explicabo ex dicta quis repellat aspernatur ullam quisquam necessitatibus at rem praesentium atque est officia quisquam iusto veniam corporis tempore ducimus facilis delectus totam.,in_progress
CASE000176,CUST000227,2026-01-21 17:34:34,card dispute,low,Ratione sunt iste adipisci labore expedita itaque cupiditate quisquam non consectetur aut repellendus reiciendis eveniet officiis recusandae minus.,open
CASE000177,CUST000135,2026-03-30 17:34:34,payment delay,medium,Nihil dolores doloribus culpa laboriosam architecto dignissimos possimus inventore voluptatem necessitatibus exercitationem possimus cupiditate pariatur qui quae saepe beatae.,in_progress
CASE000178,CUST000852,2026-02-15 17:34:34,payment delay,medium,Iure nam reprehenderit debitis veritatis architecto autem repellendus quo fugiat laudantium optio at repellendus suscipit temporibus odio a corporis corrupti minus harum neque deserunt.,resolved
CASE000179,CUST000235,2026-04-09 17:34:34,fraud concern,low,Error recusandae perspiciatis ullam vel quaerat totam voluptatibus nesciunt nostrum magni sed sequi aperiam tempore voluptas a nam.,in_progress
CASE000180,CUST000506,2026-05-16 17:34:34,fraud concern,medium,Autem eligendi adipisci inventore nihil numquam quae illo ipsa distinctio cupiditate consequuntur nam sapiente facere impedit enim sit.,closed
CASE000181,CUST000370,2025-12-07 17:34:34,account closure request,low,Consequatur asperiores accusamus quam laborum ipsa voluptatibus assumenda odit impedit iste ratione non.,resolved
CASE000182,CUST000311,2026-02-10 17:34:34,payment delay,low,Numquam iste incidunt reprehenderit harum dolorem incidunt ab libero quasi quae earum unde nemo alias alias laboriosam fuga neque vitae.,resolved
CASE000183,CUST000118,2026-03-16 17:34:34,card dispute,low,Consequuntur quasi voluptates voluptates quod iure aspernatur suscipit at iusto qui vero.,resolved
CASE000184,CUST000033,2026-02-08 17:34:34,login problem,low,Placeat molestiae neque nostrum temporibus modi ab iste temporibus nemo ex explicabo.,in_progress
CASE000185,CUST000433,2026-02-16 17:34:34,account closure request,medium,Enim alias ullam quibusdam quas natus aperiam labore cumque amet voluptatibus repellat numquam enim assumenda magni sed.,resolved
CASE000186,CUST000942,2026-04-26 17:34:34,fraud concern,medium,Dolorum nulla eius ducimus qui nobis tenetur qui omnis fuga cupiditate quos doloremque debitis minima alias voluptates.,closed
CASE000187,CUST000342,2026-03-10 17:34:34,account closure request,low,Nisi reprehenderit saepe quidem impedit fugit optio quas cumque neque sapiente amet eaque reprehenderit.,open
CASE000188,CUST000116,2025-12-05 17:34:34,card dispute,medium,Cumque id error quia quibusdam minus fugit provident labore corporis sit.,closed
CASE000189,CUST000052,2026-01-03 17:34:34,fraud concern,low,Enim reiciendis fugit et minus veritatis atque minus explicabo sapiente.,open
CASE000190,CUST000145,2026-02-10 17:34:34,credit limit question,high,Ullam similique ex eaque atque omnis hic quo quibusdam quasi nihil deserunt excepturi porro debitis molestias perferendis rerum accusamus atque aut ipsum dolor eligendi.,open
CASE000191,CUST000757,2026-05-18 17:34:34,login problem,low,Alias nulla animi nisi tempora dolor nobis commodi vero assumenda non fugiat quisquam officia rem.,in_progress
CASE000192,CUST000046,2026-01-06 17:34:34,payment delay,low,Tempore possimus ducimus iure vel odit ullam eius incidunt temporibus quo eum cum asperiores.,resolved
CASE000193,CUST000656,2026-01-27 17:34:34,address change,medium,Fugit ex animi veritatis eaque ipsam laudantium ut nostrum debitis laudantium corporis.,open
CASE000194,CUST000937,2026-02-16 17:34:34,card dispute,medium,Dolor officia totam quaerat aut asperiores necessitatibus dolorum ipsum tempore corrupti odit ut optio eaque praesentium temporibus nemo maiores velit.,resolved
CASE000195,CUST000439,2025-12-10 17:34:34,account closure request,low,Laboriosam illo quas repellat architecto dolorem fugit porro quod commodi modi voluptatibus ex esse animi voluptatum officia facilis sequi excepturi sapiente.,resolved
CASE000196,CUST000723,2025-12-04 17:34:34,credit limit question,low,Officia debitis aliquam fugit deleniti possimus tempore occaecati facere assumenda odio quasi consequuntur deserunt quaerat nihil laudantium.,in_progress
CASE000197,CUST000483,2025-12-20 17:34:34,card dispute,low,Recusandae officia libero vitae repellat vitae accusamus excepturi excepturi quam illo distinctio.,closed
CASE000198,CUST000569,2026-04-24 17:34:34,login problem,low,Itaque perspiciatis soluta corrupti neque unde alias consequuntur officiis iusto ullam aliquid praesentium consectetur cupiditate amet esse recusandae itaque cupiditate nihil repellendus.,in_progress
CASE000199,CUST000623,2026-04-08 17:34:34,credit limit question,medium,Beatae nisi nulla aperiam dicta excepturi saepe qui illo blanditiis placeat molestias eum.,open
CASE000200,CUST000309,2026-02-22 17:34:34,login problem,low,Quisquam nihil excepturi blanditiis consequuntur impedit possimus mollitia ipsa unde aliquam aut sed nostrum quod.,closed
CASE000201,CUST000845,2026-03-29 17:34:34,login problem,low,Sunt aspernatur ab unde provident nisi eligendi possimus recusandae labore consectetur.,resolved
CASE000202,CUST000736,2026-04-19 17:34:34,credit limit question,high,Odit minima illum vel nostrum alias debitis libero veniam occaecati quos expedita a doloremque.,open
CASE000203,CUST000143,2026-01-15 17:34:34,address change,high,Voluptates voluptate nulla sint voluptates magni iure occaecati dignissimos amet beatae corrupti sapiente.,resolved
CASE000204,CUST000755,2026-01-04 17:34:34,account closure request,high,Libero cum ullam amet facilis distinctio dolorum nulla suscipit iste autem amet modi culpa adipisci maiores architecto doloremque ipsam neque in.,resolved
CASE000205,CUST000453,2026-03-15 17:34:34,credit limit question,low,Dolorem beatae dolorem dolores impedit dicta tempora asperiores nesciunt amet ipsa dolor non debitis fuga itaque deserunt facere.,open
CASE000206,CUST000137,2026-02-25 17:34:34,credit limit question,high,Dicta consectetur porro animi consequatur sequi itaque cupiditate exercitationem suscipit nobis ratione odit nostrum cumque voluptas.,in_progress
CASE000207,CUST000970,2026-04-18 17:34:34,account closure request,low,Assumenda sequi laudantium voluptatum nihil saepe eius quas quasi doloribus eveniet neque tempora nihil corrupti nemo.,in_progress
CASE000208,CUST000835,2026-01-24 17:34:34,credit limit question,low,In aliquid voluptatibus quasi magnam incidunt hic repellat possimus atque.,in_progress
CASE000209,CUST000579,2026-02-11 17:34:34,address change,medium,Dolores nam accusamus quasi veniam consequatur eos officia at laboriosam esse provident similique quibusdam ad iste quo soluta illo ratione fuga iure.,in_progress
CASE000210,CUST000247,2025-12-19 17:34:34,credit limit question,low,Similique architecto tempora ex adipisci incidunt earum veniam molestiae recusandae.,resolved
CASE000211,CUST000769,2026-03-18 17:34:34,card dispute,medium,Nulla excepturi ut maiores tenetur facilis amet fugit iure aliquam facilis officia.,open
CASE000212,CUST000378,2026-03-19 17:34:34,credit limit question,medium,Natus quo consequuntur ex molestiae officiis qui quibusdam sit praesentium quidem quis.,open
CASE000213,CUST000832,2025-12-05 17:34:34,account closure request,low,Explicabo eaque perspiciatis eius aperiam exercitationem laborum minima commodi quae perspiciatis minus eos numquam reiciendis veniam repellat velit.,closed
CASE000214,CUST000892,2026-01-28 17:34:34,login problem,medium,Deleniti sunt assumenda hic debitis vero aspernatur cum beatae corporis corrupti dignissimos.,open
CASE000215,CUST000776,2026-05-09 17:34:34,credit limit question,high,Ad impedit placeat ut labore in qui accusantium deleniti ad reiciendis rerum maxime excepturi neque omnis ratione laborum pariatur minus molestias itaque necessitatibus tempore esse.,in_progress
CASE000216,CUST000357,2025-12-09 17:34:34,account closure request,high,Dolorem fuga enim sapiente corporis eligendi vero nulla cum modi delectus cupiditate provident temporibus recusandae cum.,open
CASE000217,CUST000537,2026-02-05 17:34:34,card dispute,medium,Aliquam et consectetur ea delectus natus alias et exercitationem fuga molestiae cum error.,in_progress
CASE000218,CUST000074,2026-04-10 17:34:34,credit limit question,medium,Illo libero corporis itaque eum a qui voluptate ex provident labore.,open
CASE000219,CUST000398,2026-02-21 17:34:34,login problem,medium,Voluptas quidem voluptatibus pariatur reiciendis quas ullam excepturi beatae laboriosam aliquam perspiciatis blanditiis ad nulla dolore facere.,resolved
CASE000220,CUST000557,2025-12-26 17:34:34,account closure request,medium,Animi odit nesciunt dolore vel eius ad modi ipsum perferendis assumenda maiores deserunt et non velit tenetur facere.,open
CASE000221,CUST000284,2026-03-29 17:34:34,fraud concern,medium,Quaerat incidunt harum accusamus exercitationem est ipsum natus dolor suscipit qui impedit ipsam cum.,closed
CASE000222,CUST000750,2025-12-21 17:34:34,fraud concern,low,Quas impedit saepe nisi corporis esse voluptates minima excepturi ut nihil fugiat ab odit earum cupiditate iure necessitatibus totam dicta.,open
CASE000223,CUST000016,2026-04-21 17:34:34,credit limit question,low,Enim laudantium reprehenderit error nesciunt laudantium qui dolore recusandae culpa error odit odio commodi pariatur enim debitis tenetur officia.,open
CASE000224,CUST000813,2026-03-04 17:34:34,account closure request,low,Blanditiis eius voluptatibus architecto quia neque natus sit occaecati labore possimus.,in_progress
CASE000225,CUST000307,2025-12-07 17:34:34,credit limit question,medium,Fuga quasi accusantium ea neque corporis itaque possimus facere amet facere odio veritatis.,closed
CASE000226,CUST000933,2026-04-15 17:34:34,login problem,low,Enim minus vel maiores quisquam delectus atque quibusdam molestiae sit repudiandae.,resolved
CASE000227,CUST000003,2026-05-12 17:34:34,fraud concern,low,Earum praesentium facere modi expedita corporis consequatur eligendi quod illum ullam cum dolor magnam rerum recusandae nam.,in_progress
CASE000228,CUST000130,2025-12-27 17:34:34,credit limit question,medium,Sapiente quae praesentium rem impedit totam blanditiis consectetur accusantium expedita porro consequuntur ipsam voluptates minima voluptas cupiditate esse quia blanditiis consectetur possimus.,resolved
CASE000229,CUST000349,2026-04-25 17:34:34,payment delay,medium,Esse distinctio voluptatem incidunt quis beatae accusantium laborum inventore deserunt adipisci optio nihil iusto tenetur aliquam.,open
CASE000230,CUST000677,2025-11-30 17:34:34,address change,high,Pariatur quidem quos ullam dignissimos temporibus delectus expedita at sapiente velit veniam expedita cum magnam quas doloribus.,in_progress
CASE000231,CUST000742,2026-02-12 17:34:34,credit limit question,medium,Architecto reprehenderit quis minus quaerat vitae cupiditate quidem a quas unde ullam sed labore praesentium delectus perferendis autem rerum voluptatem incidunt maiores illum.,resolved
CASE000232,CUST000533,2026-05-26 17:34:34,login problem,medium,Commodi beatae consequatur quis provident nam aliquam eveniet blanditiis eligendi nobis est voluptate ipsam mollitia enim sequi deleniti.,open
CASE000233,CUST000716,2026-05-01 17:34:34,card dispute,medium,Tempora rem vel facilis accusamus perferendis perferendis id minima perspiciatis blanditiis hic.,in_progress
CASE000234,CUST000392,2025-12-18 17:34:34,login problem,high,Voluptate qui tempora cumque facilis dicta dicta sapiente illo doloremque incidunt libero quisquam quisquam nisi quidem reiciendis velit explicabo pariatur veniam voluptates maiores corporis.,resolved
CASE000235,CUST000729,2026-02-14 17:34:34,card dispute,low,Autem dolorum libero occaecati consequatur aut amet architecto perspiciatis voluptas fugit perspiciatis corrupti numquam atque asperiores quibusdam quisquam recusandae dicta optio.,resolved
CASE000236,CUST000623,2026-03-07 17:34:34,card dispute,low,Magnam molestiae repellat molestiae accusantium quisquam voluptatibus sunt blanditiis ipsum sequi ipsam alias debitis optio quod suscipit cum inventore est harum.,in_progress
CASE000237,CUST000309,2026-05-03 17:34:34,payment delay,medium,Necessitatibus laudantium mollitia molestiae iusto natus culpa animi ea nihil fugiat perspiciatis quisquam.,in_progress
CASE000238,CUST000369,2026-05-19 17:34:34,login problem,low,Eum adipisci aliquid saepe expedita quia ad tempora exercitationem atque exercitationem facere expedita optio dolorum officia nihil.,open
CASE000239,CUST000872,2026-01-27 17:34:34,address change,medium,Sit beatae cumque modi alias omnis in maiores in accusantium iusto ad.,in_progress
CASE000240,CUST000007,2025-12-25 17:34:34,card dispute,high,Fugiat hic nemo repellat aut perferendis excepturi magnam quisquam excepturi nostrum facilis ipsa libero sed ratione saepe modi.,closed
CASE000241,CUST000990,2026-04-15 17:34:34,card dispute,high,Eaque error nemo rem numquam vero quaerat neque nihil earum necessitatibus minus incidunt expedita asperiores reprehenderit magnam.,resolved
CASE000242,CUST000232,2025-12-02 17:34:34,address change,low,Inventore molestiae dicta illo numquam iste quis debitis accusantium provident sint nemo distinctio vitae quia iusto vel.,resolved
CASE000243,CUST000109,2026-01-07 17:34:34,payment delay,high,Repellat sequi tenetur vel quas animi dicta iure dolores quia quisquam sapiente illum similique tenetur odio sapiente eaque enim cum porro doloremque dolores.,closed
CASE000244,CUST000947,2026-02-21 17:34:34,account closure request,low,Deleniti doloribus repudiandae iure nam ipsa officia alias cum consequatur ea rem omnis debitis.,open
CASE000245,CUST000451,2026-02-14 17:34:34,card dispute,low,Vitae laborum accusantium similique assumenda nobis sint tempore illum facilis omnis.,open
CASE000246,CUST000836,2026-02-06 17:34:34,credit limit question,low,Id saepe sapiente doloremque necessitatibus magnam blanditiis optio neque quod minima libero.,open
CASE000247,CUST000249,2026-04-21 17:34:34,address change,high,Dolores commodi rem eveniet nesciunt harum quibusdam doloremque in corporis cupiditate voluptas.,closed
CASE000248,CUST000463,2026-02-26 17:34:34,address change,low,Illum sint animi modi praesentium beatae molestias labore doloribus eius quos corporis labore facilis est officia temporibus alias qui reiciendis.,in_progress
CASE000249,CUST000473,2026-05-19 17:34:34,login problem,medium,Porro ratione dolores mollitia est vero facilis repellat commodi sint similique.,open
CASE000250,CUST000927,2026-01-27 17:34:34,account closure request,low,Ab vero unde ullam error vel quidem error similique cum ipsa et repellat officia ratione earum aspernatur quod laudantium.,closed
CASE000251,CUST000717,2026-05-17 17:34:34,login problem,low,Unde ex in ullam aut cum ea architecto in quas molestias eveniet possimus quis odit delectus ipsam odit a dicta.,open
CASE000252,CUST000751,2026-02-20 17:34:34,card dispute,low,Et aspernatur culpa maiores voluptas rerum quis sed placeat recusandae eum laboriosam quasi ea porro repudiandae reiciendis.,in_progress
CASE000253,CUST000472,2026-04-10 17:34:34,card dispute,low,Assumenda facilis hic fugiat rerum necessitatibus accusantium ad nam nostrum dolorem at iure ea sequi.,in_progress
CASE000254,CUST000511,2026-03-10 17:34:34,payment delay,medium,Id inventore ea at facilis veniam blanditiis quaerat ipsa ullam iste.,resolved
CASE000255,CUST000270,2026-01-16 17:34:34,credit limit question,medium,Blanditiis quae deleniti similique quos enim laudantium consectetur sequi nobis voluptatum eligendi perspiciatis in illum corporis enim ea nulla tenetur fuga placeat.,closed
CASE000256,CUST000464,2026-04-15 17:34:34,credit limit question,low,Assumenda iusto sit voluptate id distinctio fugit incidunt nisi asperiores nam amet ut iusto explicabo non perferendis rem quae repellat a.,in_progress
CASE000257,CUST000782,2026-05-16 17:34:34,payment delay,low,Nulla esse hic fuga voluptas nam neque ea magnam ut soluta consequatur et minus consequuntur blanditiis aliquid consectetur sit rerum quibusdam unde.,resolved
CASE000258,CUST000383,2026-03-04 17:34:34,address change,medium,Temporibus ea repudiandae unde maxime ipsa cumque qui laudantium veniam nam ullam odio ipsam deleniti amet delectus.,closed
CASE000259,CUST000015,2026-01-03 17:34:34,credit limit question,low,Ea provident ipsa voluptatum unde aliquam explicabo quae laborum laudantium sapiente sint commodi atque sit debitis cumque magni earum tempora nesciunt.,closed
CASE000260,CUST000454,2026-05-12 17:34:34,account closure request,low,Voluptatum a quisquam debitis ullam doloribus libero atque eveniet eligendi voluptatem commodi fuga ut autem eum adipisci itaque provident laboriosam occaecati earum omnis eveniet.,resolved
